{
  "run_id": "ohm_like_atom_contacts_strict_smoke_kras_g12c_100r_seedcutoff5p0a",
  "created_at": "2026-05-26T19:14:07.384359+00:00",
  "dataset_slug": "kras_g12c",
  "input": {
    "pdb_id": "4OBE",
    "chain_id": "A",
    "graph_path": "analysis/kras_g12c/runs/ohm_like_atom_contacts_strict_smoke_kras_g12c_100r_seedcutoff5p0a/connectivity-matrix.csv",
    "metadata_paths": [
      "data/kras_g12c/rcsb/4obe/4OBE.pdb",
      "data/kras_g12c/rcsb/4obe/4OBE.cif",
      "data/kras_g12c/rcsb/4obe/4OBE_entry.json"
    ],
    "validation_paths_excluded_from_features": [
      "data/kras_g12c/rcsb/6oim/6OIM.pdb",
      "data/kras_g12c/rcsb/6oim/6OIM.cif",
      "data/kras_g12c/rcsb/6oim/6OIM_entry.json",
      "analysis/kras_g12c/kras_g12c-validation-ligand-contact-residues-8a.csv"
    ]
  },
  "method": {
    "name": "ohm_like_atom_contacts_strict",
    "version": "0.1.0",
    "random_seed": 20260525,
    "parameters": {
      "rounds": 100,
      "random_seed": 20260525,
      "alpha": 1.0,
      "atom_contact_cutoff_A": 3.4,
      "seed_cutoff_A": 5.0,
      "sequence_adjacent_backbone_contacts": "excluded",
      "seed_ligands": [
        "GDP",
        "MG"
      ]
    },
    "coarse_graining": "residue-level propagation probabilities from atom-wise contacts",
    "hardware_assumption": "classical paper-reproduction baseline for later quantum-inspired comparison"
  },
  "outputs": {
    "connectivity_matrix_path": "analysis/kras_g12c/runs/ohm_like_atom_contacts_strict_smoke_kras_g12c_100r_seedcutoff5p0a/connectivity-matrix.csv",
    "hit_list_path": "analysis/kras_g12c/runs/ohm_like_atom_contacts_strict_smoke_kras_g12c_100r_seedcutoff5p0a/residue-hit-list.csv",
    "report_path": "analysis/kras_g12c/runs/ohm_like_atom_contacts_strict_smoke_kras_g12c_100r_seedcutoff5p0a/method-metadata.json"
  },
  "metrics": {
    "baseline_name": "ohm_like_atom_contacts_strict",
    "scoring_status": "not_scored_prediction_stage_only",
    "strict_scoring_ready": true
  },
  "verification": {
    "command": "python3 scripts/pipeline/run_ohm_like_baseline.py --mode smoke --rounds 100",
    "exit_code": 0,
    "warnings": [
      "Validation labels intentionally not read by this prediction runner."
    ]
  },
  "git_commit": "d55edaff68cdd8cd3065e111fabd2a7052def1ff"
}
