{
  "run_id": "ohm_atom_contacts_strict_primary_kras_g12c_10000r_alpha3p0_seedcutoff5p0a__score",
  "created_at": "2026-05-27T05:43:59.991942+00:00",
  "dataset_slug": "kras_g12c",
  "input": {
    "pdb_id": "4OBE",
    "chain_id": "A",
    "graph_path": "analysis/kras_g12c/runs/ohm_atom_contacts_strict_primary_kras_g12c_10000r_alpha3p0_seedcutoff5p0a/connectivity-matrix.csv",
    "metadata_paths": [
      "analysis/kras_g12c/runs/ohm_atom_contacts_strict_primary_kras_g12c_10000r_alpha3p0_seedcutoff5p0a/method-metadata.json",
      "analysis/kras_g12c/kras_g12c-validation-ligand-contact-residues-8a.csv"
    ],
    "validation_paths_excluded_from_features": [
      "data/kras_g12c/rcsb/6oim/6OIM.pdb",
      "data/kras_g12c/rcsb/6oim/6OIM.cif",
      "data/kras_g12c/rcsb/6oim/6OIM_entry.json",
      "analysis/kras_g12c/kras_g12c-validation-ligand-contact-residues-8a.csv"
    ]
  },
  "method": {
    "name": "ohm_atom_contacts_strict__validation_scorer",
    "version": "0.1.0",
    "random_seed": null,
    "parameters": {
      "top_k": [
        1,
        3,
        5,
        10,
        20,
        50
      ],
      "validation_label_cutoff_A": 8.0
    },
    "coarse_graining": "post-prediction residue-level and hotspot-level validation scoring",
    "hardware_assumption": "classical deterministic scorer; validation labels are read only at scoring time"
  },
  "outputs": {
    "connectivity_matrix_path": "analysis/kras_g12c/runs/ohm_atom_contacts_strict_primary_kras_g12c_10000r_alpha3p0_seedcutoff5p0a/connectivity-matrix.csv",
    "hit_list_path": "analysis/kras_g12c/runs/ohm_atom_contacts_strict_primary_kras_g12c_10000r_alpha3p0_seedcutoff5p0a/residue-hit-list.csv",
    "report_path": "analysis/kras_g12c/runs/ohm_atom_contacts_strict_primary_kras_g12c_10000r_alpha3p0_seedcutoff5p0a/score-report.json"
  },
  "metrics": {
    "baseline_name": "ohm_atom_contacts_strict",
    "scoring_status": "scored_against_validation_labels",
    "top_5_validation_contact_hits": 2,
    "top_10_validation_contact_hits": 4,
    "random_baseline_mean": 2.53521127,
    "average_precision": 0.27342268,
    "auroc": 0.66850105
  },
  "verification": {
    "command": "python3 scripts/pipeline/score_residue_hit_lists.py",
    "exit_code": 0,
    "warnings": [
      "Validation labels are intentionally read only by this scorer."
    ]
  },
  "git_commit": "d55edaff68cdd8cd3065e111fabd2a7052def1ff"
}
